{"body":"Inspect the comparison; imported abandoned proposals remain historical notices, not next actions.","handoff":{"blockers":[],"commands_evaluations_run":["arw narrative trail --json"],"completed_work":["Imported public status and exported narrative trail"],"current_state":"The public abandoned disposition is recorded; scaffold baseline remains current","evidence_gathered":["https://github.com/numpy/numpy/blob/db8bac3fa50b6843fd72db54b145e04253447d38/doc/neps/nep-0016-abstract-array.rst"],"intended_target_harness":"codex","narrative_sha256":"ddf74fbb2f6473f4f7c8ec257d955a6ab51ac00256099427ba1f3467037ec2e5","next_concrete_action":"Inspect the retained comparison and unresolved questions","objective":"Inspect the source-bound narrative comparison","open_questions":["Historical causal reason remains unknown"],"relevant_artifacts_issues_files":["#120","artifact.pilot-target"],"risks":["Single-project assisted annotations; operational replay only"],"source_run_harness":{"harness":"codex","run_id":"run-f3e090cf-5302-4b22-b91b-fb5c36813b4f"}},"kind":"handoff","links":[{"event_id":"evt-61c5feeb-c00e-4807-9f36-42ad4e5e1d6f","kind":"author_target","sha256":"8a070b210e33bf89156387375c64179f465dad28b4843e25a7788179acff0340","target_id":"artifact.pilot-target"}],"memory_id":"memory.pilot-round-2","source_artifact_ids":["artifact.pilot-target"],"source_ledger_event_ids":["evt-61c5feeb-c00e-4807-9f36-42ad4e5e1d6f"],"supersedes":["memory.pilot-round-1"],"title":"Public narrative pilot continuation"}
