{"body":"Inspect the comparison; imported abandoned proposals remain historical notices, not next actions.","handoff":{"blockers":[],"commands_evaluations_run":["arw narrative trail --json"],"completed_work":["Imported public status and exported narrative trail"],"current_state":"The public abandoned disposition is recorded; scaffold baseline remains current","evidence_gathered":["https://github.com/numpy/numpy/blob/db8bac3fa50b6843fd72db54b145e04253447d38/doc/neps/nep-0017-split-out-maskedarray.rst"],"intended_target_harness":"codex","narrative_sha256":"232ee2f77e4508ba74cff8c094065dd35f354a0203a8994f3c23be555e479f05","next_concrete_action":"Inspect the retained comparison and unresolved questions","objective":"Inspect the source-bound narrative comparison","open_questions":["Historical causal reason remains unknown"],"relevant_artifacts_issues_files":["#120","artifact.pilot-target"],"risks":["Single-project assisted annotations; operational replay only"],"source_run_harness":{"harness":"codex","run_id":"run-b0667dc7-4f37-4151-bce4-5ed608fdefc5"}},"kind":"handoff","links":[{"event_id":"evt-189285a3-4e1f-43b0-95ad-31187437d814","kind":"author_target","sha256":"cc43e6672781b1726ad9e5c4095ab55e603c5fddddff7ac70948a17e3fdb89e1","target_id":"artifact.pilot-target"}],"memory_id":"memory.pilot-round-1","source_artifact_ids":["artifact.pilot-target"],"source_ledger_event_ids":["evt-189285a3-4e1f-43b0-95ad-31187437d814"],"supersedes":[],"title":"Public narrative pilot continuation"}
